{
  "schemaVersion": 1,
  "app": "revAgent",
  "evidenceType": "bootstrap-prestage",
  "producerMode": "unelevated-coordinator",
  "supervisedAdminPrestage": false,
  "generatedAtUtc": "2026-07-13T12:00:00.0000000Z",
  "generatedBySid": "S-1-5-21-111111111-222222222-333333333-1001",
  "release": {
    "root": "\\\\dpe-nas\\Dpe-Ortak\\Baris Tankut\\revAgent-deploy",
    "channel": "stable",
    "version": "2026.07.13.example",
    "releaseSequence": 20260713120000,
    "minimumAcceptedReleaseSequence": 20260712190000,
    "highestAcceptedReleaseSequence": 20260713120000,
    "channelManifestSha256": "AAAAAAAAAAAAAAAAAAAAAAAAAAAAAAAAAAAAAAAAAAAAAAAAAAAAAAAAAAAAAAAA",
    "releaseManifestSha256": "BBBBBBBBBBBBBBBBBBBBBBBBBBBBBBBBBBBBBBBBBBBBBBBBBBBBBBBBBBBBBBBB",
    "packageSha256": "CCCCCCCCCCCCCCCCCCCCCCCCCCCCCCCCCCCCCCCCCCCCCCCCCCCCCCCCCCCCCCCC",
    "signatureVerified": true,
    "pilotPolicy": null
  },
  "localBootstrapInstallerScript": "DDDDDDDDDDDDDDDDDDDDDDDDDDDDDDDDDDDDDDDDDDDDDDDDDDDDDDDDDDDDDDDD",
  "localBootstrapInstallerModule": "EEEEEEEEEEEEEEEEEEEEEEEEEEEEEEEEEEEEEEEEEEEEEEEEEEEEEEEEEEEEEEEE",
  "sources": {
    "bootstrap": "1111111111111111111111111111111111111111111111111111111111111111",
    "launcher": "2222222222222222222222222222222222222222222222222222222222222222",
    "updaterGui": "3333333333333333333333333333333333333333333333333333333333333333",
    "distributionIntegrity": "4444444444444444444444444444444444444444444444444444444444444444",
    "permissions": "9999999999999999999999999999999999999999999999999999999999999999",
    "sourceFreeMigration": "5555555555555555555555555555555555555555555555555555555555555555",
    "releaseSnapshot": "6666666666666666666666666666666666666666666666666666666666666666",
    "privilegedSnapshotUpdate": "7777777777777777777777777777777777777777777777777777777777777777",
    "bootstrapTrust": "ABABABABABABABABABABABABABABABABABABABABABABABABABABABABABABABAB",
    "bootstrapTrustBroker": "CDCDCDCDCDCDCDCDCDCDCDCDCDCDCDCDCDCDCDCDCDCDCDCDCDCDCDCDCDCDCDCD",
    "trustedKeys": "8888888888888888888888888888888888888888888888888888888888888888"
  }
}
